Sheet: OECD.Stat export
A1: =DotStatQuery(RC[1]) -> #NAME? | B1: <?xml version="1.0" encoding="utf-16"?><WebTableParameter xmlns:xsd="http://www.w3.org/2001/XMLSchema" xmlns:xsi="http://www.w3.org/2001/XMLSchema-instance" xmlns="http://stats.oecd.org/OECDStatWS/2004/03/01/"><DataTable Code="EAG_EARNINGS" HasMetadata="true"><Name LocaleIsoCode="en">Education and earnings</Name><Name LocaleIsoCode="fr">Education and earnings</Name><Dimension Code="COUNTRY" HasMetadata="false" CommonCode="LOCATION" Display="codes"><Name LocaleIsoCode="en">Country</Name><Name LocaleIsoCode="fr">Pays</Name><Member Code="NLD" HasMetadata="false" HasOnlyUnitMetadata="false" HasChild="0"><Name LocaleIsoCode="en">Netherlands</Name><Name LocaleIsoCode="fr">Pays-Bas</Name></Member></Dimension><Dimension Code="ISC11A" HasMetadata="false" Display="codes"><Name LocaleIsoCode="en">ISCED 2011 A education level</Name><Name LocaleIsoCode="fr">ISCED 2011 A education level</Name><Member Code="L0T2" HasMetadata="false" HasOnlyUnitMetadata="false" HasChild="0"><Name LocaleIsoCode="en">Below upper secondary education</Name><Name LocaleIsoCode="fr">Inférieur au deuxième cycle du secondaire</Name></Member><Member Code="L3" HasMetadata="false" HasOnlyUnitMetadata="false" HasChild="0"><Name LocaleIsoCode="en">Upper secondary education</Name><Name LocaleIsoCode="fr">Deuxième cycle du secondaire </Name></Member><Member Code="L5" HasMetadata="false" HasOnlyUnitMetadata="false" HasChild="0"><Name LocaleIsoCode="en">Short-cycle tertiary education</Name><Name LocaleIsoCode="fr">Tertiaire de cycle court</Name></Member><Member Code="L6" HasMetadata="false" HasOnlyUnitMetadata="false" HasChild="0"><Name LocaleIsoCode="en">Bachelor’s or equivalent education</Name><Name LocaleIsoCode="fr">Niveau licence ou équivalent</Name></Member><Member Code="L7T8" HasMetadata="false" HasOnlyUnitMetadata="false" HasChild="0"><Name LocaleIsoCode="en">Master’s, Doctoral or equivalent education</Name><Name LocaleIsoCode="fr">Niveau master, doctorat ou équivalent </Name></Member></Dimension><Dimension Code="SEX" HasMetadata="false" Display="codes"><Name LocaleIsoCode="en">Gender</Name><Name LocaleIsoCode="fr">Sexe</Name><Member Code="F" HasMetadata="false" HasOnlyUnitMetadata="false" HasChild="0"><Name LocaleIsoCode="en">Women</Name><Name LocaleIsoCode="fr">Femmes</Name></Member><Member Code="M" HasMetadata="false" HasOnlyUnitMetadata="false" HasChild="0"><Name LocaleIsoCode="en">Men</Name><Name LocaleIsoCode="fr">Hommes</Name></Member></Dimension><Dimension Code="AGE" HasMetadata="false" Display="codes"><Name LocaleIsoCode="en">Age</Name><Name LocaleIsoCode="fr">Age</Name><Member Code="Y25T64" HasMetadata="false" HasOnlyUnitMetadata="false" HasChild="0"><Name LocaleIsoCode="en">25-64 years</Name><Name LocaleIsoCode="fr">25-64 ans</Name></Member><Member Code="Y25T34" HasMetadata="false" HasOnlyUnitMetadata="false" HasChild="0"><Name LocaleIsoCode="en">25-34 years</Name><Name LocaleIsoCode="fr">25-34 ans</Name></Member><Member Code="Y55T64" HasMetadata="false" HasOnlyUnitMetadata="false" HasChild="0"><Name LocaleIsoCode="en">55-64 years</Name><Name LocaleIsoCode="fr">55-64 ans</Name></Member></Dimension><Dimension Code="EARN_CATEGORY" HasMetadata="false" Display="codes"><Name LocaleIsoCode="en">Earnings category</Name><Name LocaleIsoCode="fr">Earnings category</Name><Member Code="FTFY_EARNERS" HasMetadata="false" HasOnlyUnitMetadata="false" HasChild="0"><Name LocaleIsoCode="en">Full-time, full-year earners</Name><Name LocaleIsoCode="fr">Full-time, full-year earners</Name></Member></Dimension><Dimension Code="INDICATOR" HasMetadata="false" Display="codes"><Name LocaleIsoCode="en">INDICATOR</Name><Name LocaleIsoCode="fr">Indicateur</Name><Member Code="EARN_RELATIVE_ISCED_3" HasMetadata="false" HasOnlyUnitMetadata="false" HasChild="0"><Name LocaleIsoCode="en">Relative earnings - upper secondary education = 100</Name><Name LocaleIsoCode="fr">Relative earnings - upper secondary education = 100</Name></Member></Dimension><Dimension Code="YEAR" HasMetadata="false" CommonCode="TIME" Display="codes"><Name LocaleIsoCode="en">Reference year</Name><Name LocaleIsoCode="fr">Année de référence</Name><Member Code="2014" HasMetadata="false" HasOnlyUnitMetadata="false" HasChild="0"><Name LocaleIsoCode="en">2014</Name><Name LocaleIsoCode="fr">2014</Name></Member><Member Code="2015" HasMetadata="false" HasOnlyUnitMetadata="false" HasChild="0"><Name LocaleIsoCode="en">2015</Name><Name LocaleIsoCode="fr">2015</Name></Member></Dimension><Tabulation Axis="horizontal"><Dimension Code="INDICATOR" /></Tabulation><Tabulation Axis="vertical"><Dimension Code="SEX" /><Dimension Code="AGE" /><Dimension Code="ISC11A" /></Tabulation><Tabulation Axis="page"><Dimension Code="COUNTRY" CommonCode="LOCATION" /><Dimension Code="YEAR" CommonCode="TIME" /><Dimension Code="EARN_CATEGORY" /></Tabulation><Formatting><Labels LocaleIsoCode="en" /><Power>0</Power><Decimals>-1</Decimals><SkipEmptyLines>true</SkipEmptyLines><SkipEmptyCols>true</SkipEmptyCols><SkipLineHierarchy>true</SkipLineHierarchy><SkipColHierarchy>true</SkipColHierarchy><Page>1</Page></Formatting></DataTable><Format><ShowEmptyAxes>false</ShowEmptyAxes><TimeStamp>false</TimeStamp><Page>1</Page><EnableSort>true</EnableSort><IncludeFlagColumn>false</IncludeFlagColumn><IncludeTimeSeriesId>false</IncludeTimeSeriesId><DoBarChart>false</DoBarChart><FreezePanes>true</FreezePanes><MaxBarChartLen>65</MaxBarChartLen></Format><Query><AbsoluteUri>http://stats.oecd.org//View.aspx?QueryId=&amp;QueryType=Public&amp;Lang=en</AbsoluteUri></Query></WebTableParameter>
A2: Dataset: Education and earnings
A3: Country | E3: NLD
A4: Reference year | E4: 2014
A5: Earnings category | E5: FTFY_EARNERS
A6: Unit
A7: INDICATOR | E7: EARN_RELATIVE_ISCED_3
A8: Gender | B8: Age | C8: ISCED 2011 A education level
A9: F | B9: Y25T64 | C9: L0T2 | E9: 88.614000000000004 | G9: L0T2: Below upper secondary education
C10: L3 | E10: 100 | G10: L3: Upper secondary education
C11: L5 | E11: 120.809 | G11: L5: Short-cycle tertiary education
C12: L6 | E12: 123.03 | G12: L6: Bachelor’s or equivalent education
C13: L7T8 | E13: 163.23599999999999 | G13: L7T8: Master’s, Doctoral or equivalent educatio
B14: Y25T34 | C14: L0T2 | E14: 91.727999999999994
C15: L3 | E15: 100
C16: L5 | E16: 126.241
C17: L6 | E17: 120.679
C18: L7T8 | E18: 146.24799999999999
B19: Y55T64 | C19: L0T2 | E19: 87.444000000000003
C20: L3 | E20: 100
C21: L5 | E21: 118.34399999999999
C22: L6 | E22: 130.56399999999999
C23: L7T8 | E23: 182.102
A24: M | B24: Y25T64 | C24: L0T2 | E24: 84.899000000000001
C25: L3 | E25: 100
C26: L5 | E26: 130.84800000000001
C27: L6 | E27: 134.65600000000001
C28: L7T8 | E28: 182.208
B29: Y25T34 | C29: L0T2 | E29: 91.028000000000006
C30: L3 | E30: 100
C31: L5 | E31: 126.41500000000001
C32: L6 | E32: 121.64400000000001
C33: L7T8 | E33: 148.976
B34: Y55T64 | C34: L0T2 | E34: 77.936000000000007
C35: L3 | E35: 100
C36: L5 | E36: 121.533
C37: L6 | E37: 137.38499999999999
C38: L7T8 | E38: 184.82499999999999
A39: Data extracted on 30 Apr 2018 20:55 UTC (GMT) from OECD.Stat

Sheet: Sheet2
A1: id | B1: sex | C1: age | D1: educ | E1: wage_index | F1: wage_diff
A2: =RC[1]&"_"&RC[2]&"_"&RC[3] -> F_Y25T64_L0T2 | B2: F | C2: Y25T64 | D2: L0T2 | E2: 88.614000000000004 | F2: =RC[-1]-100 -> -11.385999999999996
A3: =RC[1]&"_"&RC[2]&"_"&RC[3] -> F_Y25T64_L3 | B3: F | C3: Y25T64 | D3: L3 | E3: 100 | F3: =RC[-1]-100 -> 0
A4: =RC[1]&"_"&RC[2]&"_"&RC[3] -> F_Y25T64_L5 | B4: F | C4: Y25T64 | D4: L5 | E4: 120.809 | F4: =RC[-1]-100 -> 20.808999999999997
A5: =RC[1]&"_"&RC[2]&"_"&RC[3] -> F_Y25T64_L6 | B5: F | C5: Y25T64 | D5: L6 | E5: 123.03 | F5: =RC[-1]-100 -> 23.03
A6: =RC[1]&"_"&RC[2]&"_"&RC[3] -> F_Y25T64_L7T8 | B6: F | C6: Y25T64 | D6: L7T8 | E6: 163.23599999999999 | F6: =RC[-1]-100 -> 63.23599999999999
A7: =RC[1]&"_"&RC[2]&"_"&RC[3] -> F_Y25T34_L0T2 | B7: F | C7: Y25T34 | D7: L0T2 | E7: 91.727999999999994 | F7: =RC[-1]-100 -> -8.2720000000000056
A8: =RC[1]&"_"&RC[2]&"_"&RC[3] -> F_Y25T34_L3 | B8: F | C8: Y25T34 | D8: L3 | E8: 100 | F8: =RC[-1]-100 -> 0
A9: =RC[1]&"_"&RC[2]&"_"&RC[3] -> F_Y25T34_L5 | B9: F | C9: Y25T34 | D9: L5 | E9: 126.241 | F9: =RC[-1]-100 -> 26.241
A10: =RC[1]&"_"&RC[2]&"_"&RC[3] -> F_Y25T34_L6 | B10: F | C10: Y25T34 | D10: L6 | E10: 120.679 | F10: =RC[-1]-100 -> 20.679000000000002
A11: =RC[1]&"_"&RC[2]&"_"&RC[3] -> F_Y25T34_L7T8 | B11: F | C11: Y25T34 | D11: L7T8 | E11: 146.24799999999999 | F11: =RC[-1]-100 -> 46.24799999999999
A12: =RC[1]&"_"&RC[2]&"_"&RC[3] -> F_Y55T64_L0T2 | B12: F | C12: Y55T64 | D12: L0T2 | E12: 87.444000000000003 | F12: =RC[-1]-100 -> -12.555999999999997
A13: =RC[1]&"_"&RC[2]&"_"&RC[3] -> F_Y55T64_L3 | B13: F | C13: Y55T64 | D13: L3 | E13: 100 | F13: =RC[-1]-100 -> 0
A14: =RC[1]&"_"&RC[2]&"_"&RC[3] -> F_Y55T64_L5 | B14: F | C14: Y55T64 | D14: L5 | E14: 118.34399999999999 | F14: =RC[-1]-100 -> 18.343999999999994
A15: =RC[1]&"_"&RC[2]&"_"&RC[3] -> F_Y55T64_L6 | B15: F | C15: Y55T64 | D15: L6 | E15: 130.56399999999999 | F15: =RC[-1]-100 -> 30.563999999999993
A16: =RC[1]&"_"&RC[2]&"_"&RC[3] -> F_Y55T64_L7T8 | B16: F | C16: Y55T64 | D16: L7T8 | E16: 182.102 | F16: =RC[-1]-100 -> 82.102000000000004
A17: =RC[1]&"_"&RC[2]&"_"&RC[3] -> M_Y25T64_L0T2 | B17: M | C17: Y25T64 | D17: L0T2 | E17: 84.899000000000001 | F17: =RC[-1]-100 -> -15.100999999999999
A18: =RC[1]&"_"&RC[2]&"_"&RC[3] -> M_Y25T64_L3 | B18: M | C18: Y25T64 | D18: L3 | E18: 100 | F18: =RC[-1]-100 -> 0
A19: =RC[1]&"_"&RC[2]&"_"&RC[3] -> M_Y25T64_L5 | B19: M | C19: Y25T64 | D19: L5 | E19: 130.84800000000001 | F19: =RC[-1]-100 -> 30.848000000000013
A20: =RC[1]&"_"&RC[2]&"_"&RC[3] -> M_Y25T64_L6 | B20: M | C20: Y25T64 | D20: L6 | E20: 134.65600000000001 | F20: =RC[-1]-100 -> 34.656000000000006
A21: =RC[1]&"_"&RC[2]&"_"&RC[3] -> M_Y25T64_L7T8 | B21: M | C21: Y25T64 | D21: L7T8 | E21: 182.208 | F21: =RC[-1]-100 -> 82.207999999999998
A22: =RC[1]&"_"&RC[2]&"_"&RC[3] -> M_Y25T34_L0T2 | B22: M | C22: Y25T34 | D22: L0T2 | E22: 91.028000000000006 | F22: =RC[-1]-100 -> -8.9719999999999942
A23: =RC[1]&"_"&RC[2]&"_"&RC[3] -> M_Y25T34_L3 | B23: M | C23: Y25T34 | D23: L3 | E23: 100 | F23: =RC[-1]-100 -> 0
A24: =RC[1]&"_"&RC[2]&"_"&RC[3] -> M_Y25T34_L5 | B24: M | C24: Y25T34 | D24: L5 | E24: 126.41500000000001 | F24: =RC[-1]-100 -> 26.415000000000006
A25: =RC[1]&"_"&RC[2]&"_"&RC[3] -> M_Y25T34_L6 | B25: M | C25: Y25T34 | D25: L6 | E25: 121.64400000000001 | F25: =RC[-1]-100 -> 21.644000000000005
A26: =RC[1]&"_"&RC[2]&"_"&RC[3] -> M_Y25T34_L7T8 | B26: M | C26: Y25T34 | D26: L7T8 | E26: 148.976 | F26: =RC[-1]-100 -> 48.975999999999999
A27: =RC[1]&"_"&RC[2]&"_"&RC[3] -> M_Y55T64_L0T2 | B27: M | C27: Y55T64 | D27: L0T2 | E27: 77.936000000000007 | F27: =RC[-1]-100 -> -22.063999999999993
A28: =RC[1]&"_"&RC[2]&"_"&RC[3] -> M_Y55T64_L3 | B28: M | C28: Y55T64 | D28: L3 | E28: 100 | F28: =RC[-1]-100 -> 0
A29: =RC[1]&"_"&RC[2]&"_"&RC[3] -> M_Y55T64_L5 | B29: M | C29: Y55T64 | D29: L5 | E29: 121.533 | F29: =RC[-1]-100 -> 21.533000000000001
A30: =RC[1]&"_"&RC[2]&"_"&RC[3] -> M_Y55T64_L6 | B30: M | C30: Y55T64 | D30: L6 | E30: 137.38499999999999 | F30: =RC[-1]-100 -> 37.384999999999991
A31: =RC[1]&"_"&RC[2]&"_"&RC[3] -> M_Y55T64_L7T8 | B31: M | C31: Y55T64 | D31: L7T8 | E31: 184.82499999999999 | F31: =RC[-1]-100 -> 84.824999999999989